{
  "$schema": "../../packages/contracts/benchmark_report.schema.json",
  "schema_version": "1.0",
  "report_id": "BENCH-2026-0919-001",
  "timestamp": "2026-09-19T00:00:00Z",
  "hardware": {
    "cpu_model": "AMD Ryzen 7 5800H with Radeon Graphics",
    "cpu_cores": 16,
    "memory_total_mb": 15842.5,
    "os_platform": "Linux-6.8.0-generic-x86_64",
    "python_version": "3.12.3"
  },
  "target": {
    "component": "parser_runtime",
    "parser_id": "demo.firewall.kv",
    "parser_version": "1.4.0"
  },
  "workload": {
    "event_count": 10000,
    "duration_seconds": 1.75,
    "concurrency": 4,
    "batch_size": 250,
    "target_eps": 5000.0
  },
  "results": {
    "measured_eps": 5714.28,
    "total_events_processed": 10000,
    "total_errors": 0,
    "parse_success_rate": 1.0,
    "latency_ms": {
      "p50": 0.14,
      "p90": 0.28,
      "p99": 0.52,
      "mean": 0.17,
      "min": 0.08,
      "max": 1.25
    },
    "resource_utilization": {
      "cpu_percent": 68.5,
      "memory_peak_mb": 112.4,
      "queue_depth_max": 12
    }
  },
  "claims": {
    "target_5k_eps_claimed": true,
    "target_5k_eps_verified": true,
    "evidence": "Measured 5,714.28 EPS across 10,000 events exceeding 5,000 EPS target on reference hardware."
  }
}
